{
  "assay": {
    "id": "html5assay",
    "version": "0.1.0"
  },
  "counts": {
    "advisory": 0,
    "blocking": 1,
    "inconclusive": 3
  },
  "evaluations": [
    {
      "findingCount": 0,
      "level": "blocking",
      "outcome": "passed",
      "path": "index.html",
      "ruleId": "H5A-DOC-001",
      "ruleVersion": "1.0.0"
    },
    {
      "findingCount": 0,
      "level": "blocking",
      "outcome": "passed",
      "path": "index.html",
      "ruleId": "H5A-DOC-002",
      "ruleVersion": "1.0.0"
    },
    {
      "findingCount": 0,
      "level": "blocking",
      "outcome": "passed",
      "path": "index.html",
      "ruleId": "H5A-DOC-003",
      "ruleVersion": "1.0.0"
    },
    {
      "findingCount": 0,
      "level": "blocking",
      "outcome": "passed",
      "path": "index.html",
      "ruleId": "H5A-DOC-004",
      "ruleVersion": "1.0.0"
    },
    {
      "findingCount": 1,
      "level": "blocking",
      "outcome": "cantTell",
      "path": "index.html",
      "ruleId": "H5A-DOC-005",
      "ruleVersion": "1.0.0"
    },
    {
      "findingCount": 0,
      "level": "advisory",
      "outcome": "passed",
      "path": "index.html",
      "ruleId": "H5A-DOC-006",
      "ruleVersion": "1.0.0"
    },
    {
      "findingCount": 0,
      "level": "blocking",
      "outcome": "passed",
      "path": "index.html",
      "ruleId": "H5A-DOC-007",
      "ruleVersion": "1.0.0"
    },
    {
      "findingCount": 0,
      "level": "blocking",
      "outcome": "passed",
      "path": "index.html",
      "ruleId": "H5A-SEM-001",
      "ruleVersion": "1.0.0"
    },
    {
      "findingCount": 0,
      "level": "blocking",
      "outcome": "passed",
      "path": "index.html",
      "ruleId": "H5A-SEM-002",
      "ruleVersion": "1.0.0"
    },
    {
      "findingCount": 0,
      "level": "advisory",
      "outcome": "passed",
      "path": "index.html",
      "ruleId": "H5A-SEM-003",
      "ruleVersion": "1.0.0"
    },
    {
      "findingCount": 0,
      "level": "blocking",
      "outcome": "passed",
      "path": "index.html",
      "ruleId": "H5A-SEM-004",
      "ruleVersion": "1.0.0"
    },
    {
      "findingCount": 0,
      "level": "blocking",
      "outcome": "passed",
      "path": "index.html",
      "ruleId": "H5A-SEM-005",
      "ruleVersion": "1.0.0"
    },
    {
      "findingCount": 0,
      "level": "blocking",
      "outcome": "inapplicable",
      "path": "index.html",
      "ruleId": "H5A-SEM-006",
      "ruleVersion": "1.0.0"
    },
    {
      "findingCount": 0,
      "level": "advisory",
      "outcome": "inapplicable",
      "path": "index.html",
      "ruleId": "H5A-SEM-007",
      "ruleVersion": "1.0.0"
    },
    {
      "findingCount": 0,
      "level": "blocking",
      "outcome": "inapplicable",
      "path": "index.html",
      "ruleId": "H5A-A11Y-001",
      "ruleVersion": "1.0.0"
    },
    {
      "findingCount": 0,
      "level": "blocking",
      "outcome": "inapplicable",
      "path": "index.html",
      "ruleId": "H5A-A11Y-002",
      "ruleVersion": "1.0.0"
    },
    {
      "findingCount": 0,
      "level": "blocking",
      "outcome": "passed",
      "path": "index.html",
      "ruleId": "H5A-A11Y-003",
      "ruleVersion": "1.0.0"
    },
    {
      "findingCount": 0,
      "level": "blocking",
      "outcome": "inapplicable",
      "path": "index.html",
      "ruleId": "H5A-A11Y-004",
      "ruleVersion": "1.0.0"
    },
    {
      "findingCount": 0,
      "level": "blocking",
      "outcome": "inapplicable",
      "path": "index.html",
      "ruleId": "H5A-A11Y-005",
      "ruleVersion": "1.0.0"
    },
    {
      "findingCount": 0,
      "level": "blocking",
      "outcome": "inapplicable",
      "path": "index.html",
      "ruleId": "H5A-A11Y-006",
      "ruleVersion": "1.0.0"
    },
    {
      "findingCount": 0,
      "level": "blocking",
      "outcome": "passed",
      "path": "index.html",
      "ruleId": "H5A-A11Y-007",
      "ruleVersion": "1.0.0"
    },
    {
      "findingCount": 0,
      "level": "blocking",
      "outcome": "inapplicable",
      "path": "index.html",
      "ruleId": "H5A-A11Y-008",
      "ruleVersion": "1.0.0"
    },
    {
      "findingCount": 0,
      "level": "advisory",
      "outcome": "inapplicable",
      "path": "index.html",
      "ruleId": "H5A-A11Y-009",
      "ruleVersion": "1.0.0"
    },
    {
      "findingCount": 0,
      "level": "blocking",
      "outcome": "inapplicable",
      "path": "index.html",
      "ruleId": "H5A-CSS-001",
      "ruleVersion": "1.0.0"
    },
    {
      "findingCount": 0,
      "level": "blocking",
      "outcome": "inapplicable",
      "path": "index.html",
      "ruleId": "H5A-CSS-002",
      "ruleVersion": "1.0.0"
    },
    {
      "findingCount": 0,
      "level": "blocking",
      "outcome": "inapplicable",
      "path": "index.html",
      "ruleId": "H5A-CSS-003",
      "ruleVersion": "1.0.0"
    },
    {
      "findingCount": 0,
      "level": "blocking",
      "outcome": "inapplicable",
      "path": "index.html",
      "ruleId": "H5A-CSS-004",
      "ruleVersion": "1.0.0"
    },
    {
      "findingCount": 1,
      "level": "blocking",
      "outcome": "cantTell",
      "path": "index.html",
      "ruleId": "H5A-CSS-005",
      "ruleVersion": "1.0.0"
    },
    {
      "findingCount": 0,
      "level": "blocking",
      "outcome": "inapplicable",
      "path": "index.html",
      "ruleId": "H5A-CSS-006",
      "ruleVersion": "1.0.0"
    },
    {
      "findingCount": 0,
      "level": "blocking",
      "outcome": "inapplicable",
      "path": "index.html",
      "ruleId": "H5A-CSS-007",
      "ruleVersion": "1.0.0"
    },
    {
      "findingCount": 0,
      "level": "blocking",
      "outcome": "inapplicable",
      "path": "index.html",
      "ruleId": "H5A-CSS-008",
      "ruleVersion": "1.0.0"
    },
    {
      "findingCount": 0,
      "level": "advisory",
      "outcome": "inapplicable",
      "path": "index.html",
      "ruleId": "H5A-CSS-009",
      "ruleVersion": "1.0.0"
    },
    {
      "findingCount": 0,
      "level": "advisory",
      "outcome": "inapplicable",
      "path": "index.html",
      "ruleId": "H5A-CSS-010",
      "ruleVersion": "1.0.0"
    },
    {
      "findingCount": 0,
      "level": "blocking",
      "outcome": "inapplicable",
      "path": "index.html",
      "ruleId": "H5A-SAFE-001",
      "ruleVersion": "1.0.0"
    },
    {
      "findingCount": 1,
      "level": "blocking",
      "outcome": "failed",
      "path": "index.html",
      "ruleId": "H5A-SAFE-002",
      "ruleVersion": "1.0.0"
    },
    {
      "findingCount": 0,
      "level": "blocking",
      "outcome": "inapplicable",
      "path": "index.html",
      "ruleId": "H5A-SAFE-003",
      "ruleVersion": "1.0.0"
    },
    {
      "findingCount": 0,
      "level": "blocking",
      "outcome": "inapplicable",
      "path": "index.html",
      "ruleId": "H5A-SAFE-004",
      "ruleVersion": "1.0.0"
    },
    {
      "findingCount": 0,
      "level": "blocking",
      "outcome": "passed",
      "path": "index.html",
      "ruleId": "H5A-SAFE-005",
      "ruleVersion": "1.0.0"
    },
    {
      "findingCount": 1,
      "level": "advisory",
      "outcome": "cantTell",
      "path": "index.html",
      "ruleId": "H5A-SAFE-006",
      "ruleVersion": "1.0.0"
    },
    {
      "findingCount": 0,
      "level": "blocking",
      "outcome": "inapplicable",
      "path": "index.html",
      "ruleId": "H5A-CFF-001",
      "ruleVersion": "1.0.0"
    },
    {
      "findingCount": 0,
      "level": "blocking",
      "outcome": "inapplicable",
      "path": "index.html",
      "ruleId": "H5A-CFF-002",
      "ruleVersion": "1.0.0"
    },
    {
      "findingCount": 0,
      "level": "blocking",
      "outcome": "inapplicable",
      "path": "index.html",
      "ruleId": "H5A-CFF-003",
      "ruleVersion": "1.0.0"
    },
    {
      "findingCount": 0,
      "level": "blocking",
      "outcome": "inapplicable",
      "path": "index.html",
      "ruleId": "H5A-CFF-004",
      "ruleVersion": "1.0.0"
    },
    {
      "findingCount": 0,
      "level": "blocking",
      "outcome": "inapplicable",
      "path": "index.html",
      "ruleId": "H5A-CFF-005",
      "ruleVersion": "1.0.0"
    },
    {
      "findingCount": 0,
      "level": "advisory",
      "outcome": "inapplicable",
      "path": "index.html",
      "ruleId": "H5A-CFF-006",
      "ruleVersion": "1.0.0"
    },
    {
      "findingCount": 0,
      "level": "blocking",
      "outcome": "inapplicable",
      "path": "index.html",
      "ruleId": "H5A-CFF-007",
      "ruleVersion": "1.0.0"
    },
    {
      "findingCount": 0,
      "level": "advisory",
      "outcome": "passed",
      "path": "index.html",
      "ruleId": "H5A-PERF-001",
      "ruleVersion": "1.0.0"
    },
    {
      "findingCount": 0,
      "level": "advisory",
      "outcome": "inapplicable",
      "path": "index.html",
      "ruleId": "H5A-PERF-002",
      "ruleVersion": "1.0.0"
    },
    {
      "findingCount": 0,
      "level": "advisory",
      "outcome": "inapplicable",
      "path": "index.html",
      "ruleId": "H5A-PERF-003",
      "ruleVersion": "1.0.0"
    },
    {
      "findingCount": 0,
      "level": "blocking",
      "outcome": "inapplicable",
      "path": "index.html",
      "ruleId": "H5A-PERF-004",
      "ruleVersion": "1.0.0"
    },
    {
      "findingCount": 0,
      "level": "blocking",
      "outcome": "inapplicable",
      "path": "index.html",
      "ruleId": "H5A-PERF-005",
      "ruleVersion": "1.0.0"
    },
    {
      "findingCount": 0,
      "level": "advisory",
      "outcome": "inapplicable",
      "path": "index.html",
      "ruleId": "H5A-PERF-006",
      "ruleVersion": "1.0.0"
    },
    {
      "findingCount": 0,
      "level": "blocking",
      "outcome": "inapplicable",
      "path": "index.html",
      "ruleId": "H5A-THEME-001",
      "ruleVersion": "1.0.0"
    },
    {
      "findingCount": 0,
      "level": "blocking",